{"amountMinorUnits":"6000","cashLegs":[{"boundary":"external","bucketId":"operating-cash","currency":"USD","deltaMinorUnits":"6000","legId":"leg-1"}],"classification":{"basis":"cash","categoryId":"program-service-fees","categoryVersion":"1","flow":"operating","restrictionId":null},"controls":{"approvalRefs":[],"conflictRefs":[],"supportingCommitments":[]},"currency":"USD","demoLabel":"Demo data — not VT Infinite's financial records.","effectiveDate":"2000-02-01","entityId":"demo","environment":"synthetic-demo","eventId":"1378f4cd-49a9-431a-8628-38fbe52c9ce3","eventSequence":"6","evidence":{"reportRefs":[]},"periodId":"2000-Q1","programId":"program-alpha","publishedAt":"2000-04-14T16:00:00Z","purpose":{"text":"Synthetic golden vector leaves-8, event 6 (demo)."},"schema":"marrs-rover.event.1","type":"receipt"}