{"amountMinorUnits":"200000","cashLegs":[{"boundary":"internal","bucketId":"operating-cash","currency":"USD","deltaMinorUnits":"-200000","legId":"leg-1"},{"boundary":"internal","bucketId":"reserve-cash","currency":"USD","deltaMinorUnits":"200000","legId":"leg-2"}],"classification":{"basis":"cash","categoryId":"internal-transfer","categoryVersion":"1","flow":"transfer","restrictionId":null},"controls":{"approvalRefs":[],"conflictRefs":[],"supportingCommitments":[]},"currency":"USD","demoLabel":"Demo data — not VT Infinite's financial records.","effectiveDate":"2000-02-01","entityId":"demo","environment":"synthetic-demo","eventId":"eae0a792-08b9-4a50-8f1d-d86aa29eb8d1","eventSequence":"2","evidence":{"reportRefs":[]},"periodId":"2000-Q1","programId":"program-alpha","publishedAt":"2000-04-14T16:00:00Z","purpose":{"text":"Synthetic golden vector transfers, event 2 (demo)."},"schema":"marrs-rover.event.1","transferKind":"internal","type":"transfer"}