{"amountMinorUnits":"1250","cashLegs":[{"boundary":"external","bucketId":"operating-cash","currency":"USD","deltaMinorUnits":"1250","legId":"leg-1"}],"classification":{"basis":"cash","categoryId":"program-service-fees","categoryVersion":"1","flow":"operating","restrictionId":null},"controls":{"approvalRefs":[],"conflictRefs":[],"supportingCommitments":[]},"currency":"USD","demoLabel":"Demo data — not VT Infinite's financial records.","effectiveDate":"2000-02-01","entityId":"demo","environment":"synthetic-demo","eventId":"ea04ea32-add1-42a0-b542-f15ae81037ef","eventSequence":"1","evidence":{"reportRefs":[]},"periodId":"2000-Q1","programId":"program-alpha","publishedAt":"2000-04-14T16:00:00Z","purpose":{"text":"Synthetic naïve café receipt — 日本語 — €12 — 𝄞 — \"quoted\" (demo)."},"schema":"marrs-rover.event.1","type":"receipt"}