{"amountMinorUnits":"50000","cashLegs":[{"boundary":"boundary","bucketId":"reserve-cash","currency":"USD","deltaMinorUnits":"-50000","legId":"leg-1"}],"classification":{"basis":"cash","categoryId":"boundary-transfer","categoryVersion":"1","flow":"transfer","restrictionId":null},"controls":{"approvalRefs":[],"conflictRefs":[],"supportingCommitments":[]},"currency":"USD","demoLabel":"Demo data — not VT Infinite's financial records.","effectiveDate":"2000-02-01","entityId":"demo","environment":"synthetic-demo","eventId":"d2c6ff50-21ee-49ed-a061-2c504cd75d0c","eventSequence":"3","evidence":{"reportRefs":[]},"periodId":"2000-Q1","programId":"program-alpha","publishedAt":"2000-04-14T16:00:00Z","purpose":{"text":"Synthetic golden vector transfers, event 3 (demo)."},"schema":"marrs-rover.event.1","transferKind":"boundary","type":"transfer"}