{"amountMinorUnits":"9000","cashLegs":[{"boundary":"external","bucketId":"operating-cash-eur","currency":"EUR","deltaMinorUnits":"9000","legId":"leg-1"}],"classification":{"basis":"cash","categoryId":"program-service-fees","categoryVersion":"1","flow":"operating","restrictionId":null},"controls":{"approvalRefs":[],"conflictRefs":[],"supportingCommitments":[]},"currency":"EUR","demoLabel":"Demo data — not VT Infinite's financial records.","effectiveDate":"2000-02-01","entityId":"demo","environment":"synthetic-demo","eventId":"64013191-77d3-48c9-a200-7d71055fa154","eventSequence":"2","evidence":{"reportRefs":[]},"periodId":"2000-Q1","programId":"program-alpha","publishedAt":"2000-04-14T16:00:00Z","purpose":{"text":"Synthetic golden vector multi-currency, event 2 (demo)."},"schema":"marrs-rover.event.1","type":"receipt"}