{"amountMinorUnits":"64000","cashLegs":[{"boundary":"external","bucketId":"operating-cash","currency":"USD","deltaMinorUnits":"-64000","legId":"leg-1"}],"classification":{"basis":"cash","categoryId":"program-supplies","categoryVersion":"1","flow":"operating","restrictionId":null},"controls":{"approvalRefs":[],"conflictRefs":[],"supportingCommitments":[]},"currency":"USD","demoLabel":"Demo data — not VT Infinite's financial records.","effectiveDate":"2000-02-01","entityId":"demo","environment":"synthetic-demo","eventId":"4fa3253e-c88d-4b34-b149-442a56a1b2ce","eventSequence":"1","evidence":{"reportRefs":[]},"periodId":"2000-Q1","programId":"program-alpha","publishedAt":"2000-04-14T16:00:00Z","purpose":{"text":"Synthetic golden vector correction, event 1 (demo)."},"schema":"marrs-rover.event.1","type":"disbursement"}