{"amountMinorUnits":"2500","cashLegs":[{"boundary":"external","bucketId":"operating-cash-eur","currency":"EUR","deltaMinorUnits":"-2500","legId":"leg-1"}],"classification":{"basis":"cash","categoryId":"program-supplies","categoryVersion":"1","flow":"operating","restrictionId":null},"controls":{"approvalRefs":[],"conflictRefs":[],"supportingCommitments":[]},"currency":"EUR","demoLabel":"Demo data — not VT Infinite's financial records.","effectiveDate":"2000-02-01","entityId":"demo","environment":"synthetic-demo","eventId":"682b12a6-52e6-455a-bb36-46f509039d8a","eventSequence":"3","evidence":{"reportRefs":[]},"periodId":"2000-Q1","programId":"program-alpha","publishedAt":"2000-04-14T16:00:00Z","purpose":{"text":"Synthetic golden vector multi-currency, event 3 (demo)."},"schema":"marrs-rover.event.1","type":"disbursement"}