{"cashLegs":[],"classification":{"basis":"cash","categoryId":"reconciliation","categoryVersion":"1","flow":"none","restrictionId":null},"controls":{"approvalRefs":[],"conflictRefs":[],"supportingCommitments":[]},"demoLabel":"Demo data — not VT Infinite's financial records.","effectiveDate":"2000-03-31","entityId":"demo","environment":"synthetic-demo","eventId":"67f05d8c-e16e-4a8d-9979-608dc809adce","eventSequence":"1","evidence":{"reportRefs":[]},"periodId":"2000-Q1","programId":"general","publishedAt":"2000-04-14T16:00:00Z","purpose":{"text":"Synthetic statement: no in-scope cash activity occurred in this period (demo)."},"schema":"marrs-rover.event.1","type":"reconciliation"}